{
  "as_of": "2026-06-14",
  "cma_version": null,
  "disclosures": [
    "Educational decision-support only. This analysis is generated by a deterministic rules engine and is NOT personalized investment, tax, legal, or insurance advice. It must be reviewed and approved by a qualified fiduciary adviser before being relied upon or shared with a client.",
    "Recommendations follow a general Financial Order of Operations and the assumptions, contribution limits, and tax parameters in effect for the stated \"as of\" date. Individual circumstances may change the appropriate order.",
    "Any Monte Carlo \"probability of success\" is a modeled estimate based on the stated capital-market assumptions and a fixed random seed; it is not a guarantee of future results. Markets may behave outside the modeled range.",
    "Sources are cited for each rule. Confirm any figure against its linked primary source (IRS, SSA, statute) before acting."
  ],
  "engine_version": "0.1.0",
  "input_hash": "sha256:66ddf10dd3e6a3bd881408db8437ee3ba02efe0c9bd2f0b266cdd1b763a5987f",
  "insights": [],
  "mc_seed": null,
  "monte_carlo": null,
  "projection": null,
  "recommendations": [
    {
      "assumptions": [
        "match is non-discretionary",
        "employee stays through vesting"
      ],
      "band": "Capture full employer match",
      "citations": [
        1,
        8
      ],
      "computed": {
        "additional_contribution_annual": "5400.00",
        "current_pct": "0.03",
        "forfeited_match_annual": "2700.00",
        "full_match_annual": "5400.00",
        "match_rate": "0.5",
        "target_pct": "0.06"
      },
      "confidence": "high",
      "headline": "Raise contributions to capture the full employer match",
      "rationale_key": "employer_match_is_free_money",
      "rule_id": "foo.employer_match.capture_full",
      "step": 1
    },
    {
      "assumptions": [
        "high-interest threshold from params (default APR > 8%)"
      ],
      "band": "Pay off high-interest debt",
      "citations": [
        7
      ],
      "computed": {
        "count": 1,
        "payoff_order": [
          {
            "annual_interest": "2069.10",
            "apr": "0.2299",
            "balance": "9000.00",
            "id": "cc1",
            "rank": 1,
            "type": "credit_card"
          }
        ],
        "threshold_apr": "0.08",
        "total_annual_interest": "2069.10",
        "total_balance": "9000.00"
      },
      "confidence": "high",
      "headline": "Pay off high-interest debt (avalanche order)",
      "rationale_key": "high_interest_debt_guaranteed_return",
      "rule_id": "foo.debt.high_interest",
      "step": 2
    },
    {
      "assumptions": [
        "heuristic coverage targets; not a full needs analysis"
      ],
      "band": "Estate, insurance & advanced steps",
      "citations": [
        9
      ],
      "computed": {
        "disability_note": "Confirm long-term disability covers ~60% of gross income.",
        "estate_checklist": [
          "will",
          "durable_power_of_attorney",
          "healthcare_directive",
          "beneficiary_review",
          "community_property_titling_review"
        ],
        "has_dependents": true,
        "life_income_multiple": "10",
        "suggested_life_coverage": "1800000.00"
      },
      "confidence": "medium",
      "headline": "Review protection: life/disability coverage and estate documents",
      "rationale_key": "protect_the_plan_against_shocks",
      "rule_id": "foo.protect.review_coverage",
      "step": 3
    }
  ],
  "requires_advisor_review": true,
  "ruleset_checksum": "sha256:83515693b7aab982ba2a606b6309c997b85aaf9e259f06bdec1bf80d8a0c5a02",
  "ruleset_version": "2026.06.1",
  "schema_version": "1.0.0",
  "sources": [
    {
      "domain": "irs.gov",
      "n": 1,
      "source_type": "primary",
      "title": "401(k) contribution limits",
      "url": "https://www.irs.gov/retirement-plans/plan-participant-employee/retirement-topics-401k-and-profit-sharing-plan-contribution-limits"
    },
    {
      "domain": "consumerfinance.gov",
      "n": 7,
      "source_type": "primary",
      "title": "Debt avalanche vs snowball",
      "url": "https://www.consumerfinance.gov/ask-cfpb/what-is-the-difference-between-the-debt-snowball-and-debt-avalanche-en-2103/"
    },
    {
      "domain": "dol.gov",
      "n": 8,
      "source_type": "primary",
      "title": "Employer retirement plan types & matching",
      "url": "https://www.dol.gov/general/topic/retirement/typesofplans"
    },
    {
      "domain": "usa.gov",
      "n": 9,
      "source_type": "primary",
      "title": "Wills, estates, and probate \u2014 USAGov",
      "url": "https://www.usa.gov/wills-estates"
    }
  ],
  "trace": {
    "jurisdiction_overlay": "TX",
    "per_rule": [
      {
        "condition_result": false,
        "fired": false,
        "rule_id": "foo.emergency_fund.starter"
      },
      {
        "condition_result": true,
        "fired": true,
        "rule_id": "foo.employer_match.capture_full"
      },
      {
        "condition_result": true,
        "fired": true,
        "rule_id": "foo.debt.high_interest"
      },
      {
        "condition_result": false,
        "fired": false,
        "rule_id": "foo.emergency_fund.full"
      },
      {
        "condition_result": false,
        "fired": false,
        "rule_id": "foo.hsa.max"
      },
      {
        "condition_result": false,
        "fired": false,
        "rule_id": "foo.ira.max"
      },
      {
        "condition_result": false,
        "fired": false,
        "rule_id": "foo.employer_plan.max"
      },
      {
        "condition_result": false,
        "fired": false,
        "rule_id": "foo.taxable.hyper_accumulate"
      },
      {
        "condition_result": true,
        "fired": true,
        "rule_id": "foo.protect.review_coverage"
      }
    ],
    "rules_evaluated": 9,
    "rules_fired": 3,
    "skipped": [
      {
        "condition_result": false,
        "fired": false,
        "rule_id": "foo.emergency_fund.starter"
      },
      {
        "condition_result": false,
        "fired": false,
        "rule_id": "foo.emergency_fund.full"
      },
      {
        "condition_result": false,
        "fired": false,
        "rule_id": "foo.hsa.max"
      },
      {
        "condition_result": false,
        "fired": false,
        "rule_id": "foo.ira.max"
      },
      {
        "condition_result": false,
        "fired": false,
        "rule_id": "foo.employer_plan.max"
      },
      {
        "condition_result": false,
        "fired": false,
        "rule_id": "foo.taxable.hyper_accumulate"
      }
    ]
  }
}